{
  "project": "Constellation v6 — the Level-0 Harness, in its native language",
  "profile": "lead",
  "stage": "build",
  "updated": "2026-08-05T06:05:00Z",

  "context": {
    "summary": "Two lands this session: d002 (private remote jcbbge/constellation-v6, pushed) and d009 (neo ergonomics research → docs/research/2026-08-05-neo-ergonomics.md, verdicts routed to d010). c001's Plan phase is complete: six briefs carved into .madewell/work/packages/ — i001-i005 verification-only (Test-Designer + Runner), i006 a build package (Implementer + Test-Designer) for the CLAIM gate as an executable.",
    "openThread": "c001 awaits the Lead's commit to dispatch: wave 1 = 7 workers (5 Test-Designers + i006's Implementer/Test-Designer pair), wave 2 = Test-Runners, triage on any failure. Frontier is all six items concurrently.",
    "language": {
      "context window": "context pane — stained glass, each shard a different artifact",
      "abandoned at 40%": "the descent — going down a layer, not failing at one",
      "exploration": "digging holes to see what comes up",
      "phase": "house — Dawn, Meridian, Descent, Night",
      "agent": "star",
      "coordination signal": "pheromone, written to the Nebula"
    }
  },

  "discovery": [
    { "id": "d003", "item": "Decide Topic 1 naming: fractal-renamed vs role-axis vs both", "scope": "identity", "dependsOn": [] },
    { "id": "d004", "item": "Decide whether the Latent Workspace earns a place in v6 or stays deferred — the only idea the project's own rubric ever scored 10X, unbuilt across five iterations", "scope": "architecture", "dependsOn": [] },
    { "id": "d005", "item": "Bring the orbiting organs into Constellation and rename them celestially (Rumen, Strudel, Tower, Circadian)", "scope": "convergence", "dependsOn": ["d003"] },
    { "id": "d006", "item": "Wire the REPL-over-MCP bridge", "scope": "tooling", "dependsOn": [] },
    { "id": "d007", "item": "Resolve the five open questions in docs/PANE-COMPILER-PRD.md (pane token budget, pi.dev hook surfaces, Alembic's fate, fold executor, seam-view home) before the PRD becomes a working blueprint", "scope": "context-layer", "dependsOn": [] },
    { "id": "d008", "item": "Decide the relationship between the Pane Compiler and Circadian/Alembic — fold into the substrate, leave parallel, or decommission", "scope": "convergence", "dependsOn": ["d007"] },
    { "id": "d010", "item": "Ergonomics surface decisions from docs/research/2026-08-05-neo-ergonomics.md — 10 adopt + 3 adapt items (doctor subcommand, first-hit annotated config, session env vars, transcript invariants, calm TUI rules, charter-carried tool sets, subprocess extension filters, named phases). Pull items into cycles as each v6 surface gets built.", "scope": "ergonomics", "dependsOn": [] }
  ],

  "active": [
    { "id": "d001", "cycle": ".madewell/cycles/c001.json" }
  ],

  "blocked": [
    { "id": "d006", "reason": "jsulmont/mcp-lisp has no license file — GitHub API .license = null, contradicting its README. Taking it into the harness/runtime seam is an operator call.", "unblocks": "the author adds license files (ask via issue), or we vendor stdio-only under a resolved license" }
  ]
}
